{
  "proof_id": "zk-dp-1782384816",
  "statement": "Demographic Parity proof for retail credit expert node",
  "proving_system": "groth16",
  "public_inputs": [
    "threshold:0.05",
    "actual_delta:0.0262"
  ],
  "verification": {
    "gc_ir_verifier": "https://sentinel.internal/verifiers/zk-dp-v1.json",
    "key_fingerprint": "SHA256:7f8e9d0a1b2c3d4e5f6g7h8i9j0k1l2m3n4o5p6q7r8s9t0u1v2w3x4y5z6a7b8c"
  }
}